<?xml version="1.0" encoding="UTF-8"?>
<!DOCTYPE averageWarmEmissionFactorFile SYSTEM "../../dtd/emissions_v1.dtd">
<averageWarmEmissionFactorFile>
    <pollutant name="CO">
        <segment type="PASSENGER_CAR" fuel="PETROL">
            <speed value="0.0" unit="km/h" amount="100.0" unit="g/km"/>
            <speed value="30.0" unit="km/h" amount="20.0" unit="g/km"/>
            <speed value="50.0" unit="km/h" amount="10.0" unit="g/km"/>
        </segment>
        <segment type="PASSENGER_CAR" fuel="DIESEL">
            <speed value="0.0" unit="km/h" amount="90.0" unit="g/km"/>
            <speed value="30.0" unit="km/h" amount="15.0" unit="g/km"/>
            <speed value="50.0" unit="km/h" amount="8.0" unit="g/km"/>
        </segment>
    </pollutant>
</averageWarmEmissionFactorFile>
